<?xml version="1.0" encoding="UTF-8"?>
<!--
  LearnSphere – Courses Data File (courses.xml)
  Web Programming Assignment 1, 2025-26
  CBIT Hyderabad
-->
<learnsphere xmlns:xsi="http://www.w3.org/2001/XMLSchema-instance"
             xsi:noNamespaceSchemaLocation="courses.xsd">

  <platform>
    <name>LearnSphere</name>
    <tagline>Expand Your Horizons</tagline>
    <email>info@learnsphere.in</email>
    <phone>+91 98765 43210</phone>
    <address>Plot No. 42, Madhapur, Hyderabad, Telangana - 500081, India</address>
    <founded>2022</founded>
  </platform>

  <courses>

    <course id="C001">
      <title>Full-Stack Web Development</title>
      <category>Development</category>
      <instructor>
        <name>Dr. Priya Sharma</name>
        <designation>Senior Software Engineer &amp; Educator</designation>
        <experience>12 years</experience>
      </instructor>
      <price currency="INR">2499</price>
      <originalPrice currency="INR">7999</originalPrice>
      <rating>4.9</rating>
      <reviewCount>1200</reviewCount>
      <studentCount>3400</studentCount>
      <duration>
        <hours>48</hours>
        <lectures>120</lectures>
      </duration>
      <level>Beginner to Advanced</level>
      <language>English</language>
      <certificate>true</certificate>
      <description>Master HTML, CSS, JavaScript, Node.js, and React to build complete web applications from scratch. Includes 5 real-world portfolio projects.</description>
      <skills>
        <skill>HTML5 &amp; CSS3</skill>
        <skill>JavaScript ES6+</skill>
        <skill>React.js</skill>
        <skill>Node.js &amp; Express</skill>
        <skill>MongoDB</skill>
        <skill>REST APIs</skill>
      </skills>
    </course>

    <course id="C002">
      <title>Data Science with Python</title>
      <category>Data Science</category>
      <instructor>
        <name>Rahul Verma</name>
        <designation>Data Scientist at Analytics Corp</designation>
        <experience>8 years</experience>
      </instructor>
      <price currency="INR">1999</price>
      <originalPrice currency="INR">5999</originalPrice>
      <rating>4.8</rating>
      <reviewCount>980</reviewCount>
      <studentCount>2600</studentCount>
      <duration>
        <hours>36</hours>
        <lectures>95</lectures>
      </duration>
      <level>Intermediate</level>
      <language>English</language>
      <certificate>true</certificate>
      <description>Learn pandas, NumPy, Matplotlib, Scikit-learn, and build real-world machine learning models using Python.</description>
      <skills>
        <skill>Python</skill>
        <skill>Pandas &amp; NumPy</skill>
        <skill>Data Visualization</skill>
        <skill>Machine Learning</skill>
        <skill>Scikit-learn</skill>
        <skill>Statistical Analysis</skill>
      </skills>
    </course>

    <course id="C003">
      <title>UI/UX Design Masterclass</title>
      <category>Design</category>
      <instructor>
        <name>Ananya Kapoor</name>
        <designation>Lead UX Designer at DesignHub</designation>
        <experience>6 years</experience>
      </instructor>
      <price currency="INR">1799</price>
      <originalPrice currency="INR">4999</originalPrice>
      <rating>4.7</rating>
      <reviewCount>740</reviewCount>
      <studentCount>1900</studentCount>
      <duration>
        <hours>28</hours>
        <lectures>75</lectures>
      </duration>
      <level>Beginner to Intermediate</level>
      <language>English</language>
      <certificate>true</certificate>
      <description>Learn Figma, design systems, user research, wireframing, and prototyping for modern digital products.</description>
      <skills>
        <skill>Figma</skill>
        <skill>User Research</skill>
        <skill>Wireframing</skill>
        <skill>Prototyping</skill>
        <skill>Design Systems</skill>
        <skill>Accessibility</skill>
      </skills>
    </course>

    <course id="C004">
      <title>Artificial Intelligence &amp; Machine Learning</title>
      <category>Data Science</category>
      <instructor>
        <name>Dr. Meena Iyer</name>
        <designation>AI Research Scientist</designation>
        <experience>15 years</experience>
      </instructor>
      <price currency="INR">3499</price>
      <originalPrice currency="INR">9999</originalPrice>
      <rating>4.9</rating>
      <reviewCount>1100</reviewCount>
      <studentCount>2800</studentCount>
      <duration>
        <hours>60</hours>
        <lectures>150</lectures>
      </duration>
      <level>Advanced</level>
      <language>English</language>
      <certificate>true</certificate>
      <description>Deep learning, neural networks, NLP, and computer vision using TensorFlow and PyTorch. Includes hands-on research projects.</description>
      <skills>
        <skill>TensorFlow</skill>
        <skill>PyTorch</skill>
        <skill>Deep Learning</skill>
        <skill>NLP</skill>
        <skill>Computer Vision</skill>
        <skill>Model Deployment</skill>
      </skills>
    </course>

    <course id="C005">
      <title>Digital Marketing Fundamentals</title>
      <category>Business</category>
      <instructor>
        <name>Sneha Pillai</name>
        <designation>Digital Marketing Consultant</designation>
        <experience>9 years</experience>
      </instructor>
      <price currency="INR">1299</price>
      <originalPrice currency="INR">3999</originalPrice>
      <rating>4.6</rating>
      <reviewCount>620</reviewCount>
      <studentCount>1500</studentCount>
      <duration>
        <hours>20</hours>
        <lectures>55</lectures>
      </duration>
      <level>Beginner</level>
      <language>English</language>
      <certificate>true</certificate>
      <description>SEO, social media strategy, email marketing, Google Analytics, and growth hacking techniques for digital businesses.</description>
      <skills>
        <skill>SEO</skill>
        <skill>Social Media Marketing</skill>
        <skill>Email Marketing</skill>
        <skill>Google Analytics</skill>
        <skill>Content Strategy</skill>
        <skill>PPC Advertising</skill>
      </skills>
    </course>

  </courses>

</learnsphere>
